{
    "$schema": "http://json-schema.org/draft-04/schema#",
    "type": "object",
    "properties": {
      "id": {
        "type": "integer"
      },
      "firstname": {
        "type": "string"
      },
      "lastname": {
        "type": "string"
      },
      "age": {
        "type": "integer"
      },
      "gender": {
        "type": "string"
      },
      "birthday": {
        "type": "string"
      },
      "phone": {
        "type": "string"
      },
      "photo": {
        "type": "string"
      },
      "location": {
        "type": "object",
        "properties": {
          "city": {
            "type": "string"
          },
          "state": {
            "type": "string"
          }
        },
        "required": [
          "city",
          "state"
        ]
      },
      "about": {
        "type": "string"
      },
      "messages": {
        "type": "array",
        "items": [
          {
            "type": "object",
            "properties": {
              "id": {
                "type": "integer"
              },
              "name": {
                "type": "string"
              },
              "textmessage": {
                "type": "array",
                "items": [
                  {
                    "type": "object",
                    "properties": {
                      "date": {
                        "type": "string"
                      },
                      "text": {
                        "type": "string"
                      }
                    },
                    "required": [
                      "date",
                      "text"
                    ]
                  }
                ]
              }
            },
            "required": [
              "id",
              "name",
              "textmessage"
            ]
          },
          {
            "type": "object",
            "properties": {
              "id": {
                "type": "integer"
              },
              "name": {
                "type": "string"
              },
              "textmessage": {
                "type": "array",
                "items": [
                  {
                    "type": "object",
                    "properties": {
                      "date": {
                        "type": "string"
                      },
                      "text": {
                        "type": "string"
                      }
                    },
                    "required": [
                      "date",
                      "text"
                    ]
                  }
                ]
              }
            },
            "required": [
              "id",
              "name",
              "textmessage"
            ]
          },
          {
            "type": "object",
            "properties": {
              "id": {
                "type": "integer"
              },
              "name": {
                "type": "string"
              },
              "textmessage": {
                "type": "array",
                "items": [
                  {
                    "type": "object",
                    "properties": {
                      "date": {
                        "type": "string"
                      },
                      "text": {
                        "type": "string"
                      }
                    },
                    "required": [
                      "date",
                      "text"
                    ]
                  }
                ]
              }
            },
            "required": [
              "id",
              "name",
              "textmessage"
            ]
          },
          {
            "type": "object",
            "properties": {
              "id": {
                "type": "integer"
              },
              "name": {
                "type": "string"
              },
              "textmessage": {
                "type": "array",
                "items": [
                  {
                    "type": "object",
                    "properties": {
                      "date": {
                        "type": "string"
                      },
                      "text": {
                        "type": "string"
                      }
                    },
                    "required": [
                      "date",
                      "text"
                    ]
                  }
                ]
              }
            },
            "required": [
              "id",
              "name",
              "textmessage"
            ]
          }
        ]
      },
      "publications": {
        "type": "array",
        "items": {}
      }
    },
    "required": [
      "id",
      "firstname",
      "lastname",
      "age",
      "gender",
      "birthday",
      "phone",
      "photo",
      "location",
      "about",
      "messages",
      "publications"
    ]
  }